{
  "schemaVersion": 1,
  "name": "third-person-combat-project-test",
  "description": "项目化场景的上下文、资源解析和确定性玩法测试模板。",
  "goal": "验证 Agent 能从 project.json 解析项目资源根与语义资产索引，并使用显式项目根完成第三人称场景的固定输入玩法运行。",
  "mode": "preview",
  "project": {
    "projectPath": "projects/third-person-combat",
    "scenePath": "scenes/main.json",
    "game": "cesiumwalk"
  },
  "assets": {
    "queries": [
      {
        "query": "base color",
        "assetType": "textures",
        "required": true,
        "maxResults": 20
      }
    ]
  },
  "tests": {
    "compileGames": false,
    "gameplay": {
      "enabled": true,
      "frames": 900,
      "fixedDeltaSeconds": 0.016666667,
      "timeoutMs": 180000,
      "replayPath": "tools/agent_replay.example.json"
    },
    "assertions": [],
    "render": {
      "enabled": false
    },
    "capture": {
      "enabled": false
    },
    "performance": {
      "enabled": false
    }
  }
}
